method,label,rationale,true_label,claim,correct
random,SUPPORTS,Random selection,SUPPORTS,1966 was the year of birth of Justine Bateman.,True
random,SUPPORTS,Random selection,NOT ENOUGH INFO,Paris (Paris Hilton album) incorporates rhythm and lyrics of soul.,False
random,REFUTES,Random selection,REFUTES,Trace Cyrus is the cousin of Noah Cyrus.,True
random,NOT ENOUGH INFO,Random selection,REFUTES,Artpop was reviewed by dog critics.,False
random,REFUTES,Random selection,SUPPORTS,Lookout Records helped release Kerplunk.,False
random,NOT ENOUGH INFO,Random selection,NOT ENOUGH INFO,Vedam stars Indian film actors and actresses as animated penguins.,True
random,REFUTES,Random selection,REFUTES,Pirates of the Caribbean has only 1 version in a single park.,True
random,NOT ENOUGH INFO,Random selection,NOT ENOUGH INFO,Pirates of the Caribbean is in Disneyland Paris since 1996.,True
random,SUPPORTS,Random selection,REFUTES,"The United Nations Charter was vetoed in San Francisco, United States.",False
random,SUPPORTS,Random selection,REFUTES,Saturn Corporation was established in April.,False
random,SUPPORTS,Random selection,NOT ENOUGH INFO,Ron Weasley is a wizard.,False
random,SUPPORTS,Random selection,SUPPORTS,The Food Network is a channel that ran Giada at Home.,True
random,SUPPORTS,Random selection,SUPPORTS,Uranium-235 was discovered by a person who died in March.,True
random,REFUTES,Random selection,SUPPORTS,Aunt May is a character that appeared in media adaptations of a type of creative work.,False
random,SUPPORTS,Random selection,NOT ENOUGH INFO,Dakota Fanning was involved with a film called Captain America.,False
random,NOT ENOUGH INFO,Random selection,REFUTES,Daggering is associated with a genre of Filipino music.,False
random,REFUTES,Random selection,SUPPORTS,Reign Over Me is a drama movie.,False
random,SUPPORTS,Random selection,SUPPORTS,Simón Bolívar's maiden name is Simón José Antonio de la Santísima Trinidad Bolívar y Palacios.,True
random,NOT ENOUGH INFO,Random selection,SUPPORTS,The Dark Tower was released in 2017.,False
random,NOT ENOUGH INFO,Random selection,REFUTES,Liverpool is in the United States.,False
random,REFUTES,Random selection,NOT ENOUGH INFO,"Mason Evans, Jr. was assassinated in Texas.",False
random,SUPPORTS,Random selection,NOT ENOUGH INFO,Savages was created in May 2012.,False
random,NOT ENOUGH INFO,Random selection,NOT ENOUGH INFO,Kleshas are part of the plan.,True
random,NOT ENOUGH INFO,Random selection,SUPPORTS,Melancholia's cast includes Kiefer Sutherland.,False
random,NOT ENOUGH INFO,Random selection,NOT ENOUGH INFO,In the End was negatively reviewed.,True
random,SUPPORTS,Random selection,SUPPORTS,Kellyanne Conway has used a phrase.,True
random,REFUTES,Random selection,NOT ENOUGH INFO,Natural Born Killers was scored by Oliver Stone.,False
random,SUPPORTS,Random selection,SUPPORTS,Bradley Fuller is the co-owner of Platinum Dunes.,True
random,REFUTES,Random selection,NOT ENOUGH INFO,About 55 percent of the University of Mississippi's graduates come from Mississippi.,False
random,SUPPORTS,Random selection,SUPPORTS,Mike Huckabee was Governor of Arkansas.,True
random,NOT ENOUGH INFO,Random selection,REFUTES,The Colosseum is in a city in Italy.,False
random,NOT ENOUGH INFO,Random selection,REFUTES,The Road to El Dorado only stars Ben Stiller.,False
random,NOT ENOUGH INFO,Random selection,SUPPORTS,Southampton F.C. came in second in the First Division in 1983 -- 1984.,False
random,SUPPORTS,Random selection,NOT ENOUGH INFO,Taylor Lautner was visible in The Bernie Mac Show.,False
random,SUPPORTS,Random selection,SUPPORTS,"Entourage (film) was released on June 3rd, 2015.",True
random,REFUTES,Random selection,SUPPORTS,"Moonlight was filmed on a beach in Miami, Florida.",False
random,NOT ENOUGH INFO,Random selection,REFUTES,EA Black Box was founded in 1999.,False
random,NOT ENOUGH INFO,Random selection,SUPPORTS,Queen (band) formed in London in 1970.,False
random,NOT ENOUGH INFO,Random selection,SUPPORTS,Marco Polo left a chronicle of his experience.,False
random,SUPPORTS,Random selection,SUPPORTS,Jewell sings.,True
random,NOT ENOUGH INFO,Random selection,NOT ENOUGH INFO,Charles Manson is a former leader of the Manson cult.,True
random,REFUTES,Random selection,SUPPORTS,Highway to Heaven is a television series.,False
random,SUPPORTS,Random selection,REFUTES,The Endless River is an album by a band formed in Tokyo.,False
random,NOT ENOUGH INFO,Random selection,REFUTES,Halsey's debut EP is not titled Room 93.,False
random,NOT ENOUGH INFO,Random selection,NOT ENOUGH INFO,The Dark Tower has remained unreleased.,True
random,NOT ENOUGH INFO,Random selection,SUPPORTS,Janet Leigh was an actress.,False
random,SUPPORTS,Random selection,SUPPORTS,An American punk rock band made Kerplunk.,True
random,NOT ENOUGH INFO,Random selection,REFUTES,TV Choice is a roadshow series.,False
random,NOT ENOUGH INFO,Random selection,NOT ENOUGH INFO,Luke Cage was featured as a protagonist of a movie.,True
random,SUPPORTS,Random selection,SUPPORTS,Lalla Ward was born in 1951.,True
random,REFUTES,Random selection,REFUTES,Muscarinic acetylcholine receptors are in the cell membranes of certain codes.,True
random,SUPPORTS,Random selection,SUPPORTS,Numb (Linkin Park song) was in a 2010 music video game developed by Harmonix called Rock Band 3.,True
random,NOT ENOUGH INFO,Random selection,NOT ENOUGH INFO,Advertising is a closed sourced message.,True
random,SUPPORTS,Random selection,SUPPORTS,John Frusciante was in Stadium Arcadium.,True
random,REFUTES,Random selection,NOT ENOUGH INFO,Linkin Park's fourth single was In the End.,False
random,NOT ENOUGH INFO,Random selection,SUPPORTS,Liverpool was where The Beatles came together.,False
random,REFUTES,Random selection,SUPPORTS,San Diego Comic-Con was originally known as the Golden State Comic Book Convention.,False
random,NOT ENOUGH INFO,Random selection,NOT ENOUGH INFO,"Fortunes of War caused an event between actors,",True
random,SUPPORTS,Random selection,REFUTES,I Kissed a Girl was recorded by an Japanese singer.,False
random,NOT ENOUGH INFO,Random selection,REFUTES,The Millers has no cancellation announcements.,False
random,REFUTES,Random selection,REFUTES,Francis I of France died in September.,True
random,SUPPORTS,Random selection,SUPPORTS,West Virginia borders Maryland to the northeast.,True
random,REFUTES,Random selection,REFUTES,Hourglass was released just 5 weeks after Taylor's previous album.,True
random,SUPPORTS,Random selection,REFUTES,No Country for Old Men is a drama.,False
random,REFUTES,Random selection,SUPPORTS,Kelly Preston was in multiple job positions.,False
random,REFUTES,Random selection,SUPPORTS,Wales has a large region.,False
random,SUPPORTS,Random selection,SUPPORTS,Halsey signed a recording contract in 2014.,True
random,REFUTES,Random selection,REFUTES,Hush (2016 film) was written by Intrepid Pictures.,True
random,NOT ENOUGH INFO,Random selection,REFUTES,Ann Richards was the head of the legislative branch of Texas's government.,False
random,REFUTES,Random selection,NOT ENOUGH INFO,Jack Falahee is dead.,False
random,SUPPORTS,Random selection,SUPPORTS,"In 2011, Colombiana was released.",True
random,SUPPORTS,Random selection,REFUTES,Middle-earth was created by J. K. Rowling.,False
random,REFUTES,Random selection,NOT ENOUGH INFO,Sheryl Lee appeared in Annie Hall.,False
random,SUPPORTS,Random selection,REFUTES,Rupert Murdoch has worked since at least 1354.,False
random,NOT ENOUGH INFO,Random selection,REFUTES,Dave Gibbons was born on April 12.,False
random,NOT ENOUGH INFO,Random selection,NOT ENOUGH INFO,Victoria Palace Theatre is in a graveyard.,True
random,NOT ENOUGH INFO,Random selection,SUPPORTS,Franchising is regulated in over thirty countries.,False
random,REFUTES,Random selection,REFUTES,"Camden, New Jersey is the home of a school that was founded as the South Jersey Law School in 1920.",True
random,REFUTES,Random selection,SUPPORTS,Vedam stars Deeksha Seth.,False
random,REFUTES,Random selection,REFUTES,Muscarinic acetylcholine receptors are actylcholine cells.,True
random,REFUTES,Random selection,NOT ENOUGH INFO,Colin Kaepernick became a starting quarterback during the 49ers 63rd season in the National Football League.,False
random,REFUTES,Random selection,SUPPORTS,Hourglass was released 6 years after New Moon Shine.,False
random,REFUTES,Random selection,SUPPORTS,"X-Men: Apocalypse's story was developed by Kinberg, Dougherty, and Harris.",False
random,SUPPORTS,Random selection,SUPPORTS,Liverpool is in Europe.,True
random,NOT ENOUGH INFO,Random selection,NOT ENOUGH INFO,23 percent of the University of Mississippi's graduates are successful.,True
random,SUPPORTS,Random selection,REFUTES,"Murda Beatz is from Fort Erie, Montreal.",False
random,SUPPORTS,Random selection,NOT ENOUGH INFO,Steve Wozniak designed the Grand Central Terminal.,False
random,SUPPORTS,Random selection,REFUTES,Season 2 of Fargo takes place in Midwestern Canada.,False
random,REFUTES,Random selection,NOT ENOUGH INFO,A monk practices atheistic asceticism.,False
random,REFUTES,Random selection,REFUTES,The United Nations Charter was signed in Germany.,True
random,SUPPORTS,Random selection,NOT ENOUGH INFO,Touchscreens are used in wind-powered voting machines.,False
random,NOT ENOUGH INFO,Random selection,SUPPORTS,Taylor Lautner has been a voice actor.,False
random,NOT ENOUGH INFO,Random selection,SUPPORTS,Reign Over Me was scripted and directed by Mike Binder.,False
random,SUPPORTS,Random selection,NOT ENOUGH INFO,Aristotle spent almost 20 dollars at the Academy.,False
random,NOT ENOUGH INFO,Random selection,SUPPORTS,St. Anger is the eighth studio album by Metallica.,False
random,REFUTES,Random selection,SUPPORTS,Arizona is a state in the United States.,False
random,REFUTES,Random selection,SUPPORTS,The retreat of sea ice is one of the expected outcomes of global warming.,False
random,NOT ENOUGH INFO,Random selection,SUPPORTS,Numb was released in a Linkin Park DLC for 2011.,False
random,REFUTES,Random selection,SUPPORTS,CHiPs is a film that was made in the United States and categorized as comedy.,False
random,NOT ENOUGH INFO,Random selection,NOT ENOUGH INFO,Capsicum chinense originates in the Americas.,True
random,NOT ENOUGH INFO,Random selection,SUPPORTS,Warner Bros. released Avenged Sevenfold.,False
random,REFUTES,Random selection,REFUTES,Jenna Jameson started acting in erotic videos in 1990.,True
random,REFUTES,Random selection,NOT ENOUGH INFO,Edmund H. North presented an Academy Award.,False
random,REFUTES,Random selection,SUPPORTS,Polar bears depend on the Arctic Ocean as their main food source.,False
random,NOT ENOUGH INFO,Random selection,SUPPORTS,Margaret Thatcher was the most senior politician within the Conservative Party in the UK in 1975.,False
random,NOT ENOUGH INFO,Random selection,SUPPORTS,Sean Penn was in Fast Times at Ridgemont High.,False
random,NOT ENOUGH INFO,Random selection,NOT ENOUGH INFO,Mel B released a film on Virgin Records.,True
random,NOT ENOUGH INFO,Random selection,SUPPORTS,Hush (2016 film) was produced.,False
random,SUPPORTS,Random selection,REFUTES,Middle-earth was created by a Canadian writer.,False
random,SUPPORTS,Random selection,SUPPORTS,Anushka Sharma won a Filmfare Award for Best Supporting Actress.,True
random,SUPPORTS,Random selection,SUPPORTS,The dress was online.,True
random,REFUTES,Random selection,NOT ENOUGH INFO,James Jones won the All-Star Game.,False
random,SUPPORTS,Random selection,NOT ENOUGH INFO,Shane McMahon won the Hardcore Championship once in 1998.,False
random,REFUTES,Random selection,REFUTES,Southpaw is only a sports drama book.,True
random,NOT ENOUGH INFO,Random selection,REFUTES,"Alexandra Daddario was born on March 22, 1986.",False
random,NOT ENOUGH INFO,Random selection,NOT ENOUGH INFO,Rhythm Nation was the highest grossing cover by Girls' Generation.,True
random,NOT ENOUGH INFO,Random selection,NOT ENOUGH INFO,Eddie Guerrero had estates that were incorporated into his storylines.,True
random,REFUTES,Random selection,SUPPORTS,Pearl Jam is a rock band.,False
random,NOT ENOUGH INFO,Random selection,SUPPORTS,"Kenneth Lonergan was born in New York on October 16, 1962.",False
random,REFUTES,Random selection,NOT ENOUGH INFO,Brubaker is an award-winning film.,False
random,NOT ENOUGH INFO,Random selection,SUPPORTS,Hashtags were used to respond to the dress.,False
random,REFUTES,Random selection,REFUTES,Terry Crews played only on the Pittsburgh Steelers.,True
random,NOT ENOUGH INFO,Random selection,SUPPORTS,The Chrysler Building was the world's tallest building for 11 months.,False
random,REFUTES,Random selection,REFUTES,Men in Black II is a 1992 film.,True
random,NOT ENOUGH INFO,Random selection,REFUTES,Riverdale is an original work.,False
random,REFUTES,Random selection,NOT ENOUGH INFO,Robert Palmer (writer) played an instrument in a group.,False
random,REFUTES,Random selection,REFUTES,Smriti Mandhana was born in August.,True
random,NOT ENOUGH INFO,Random selection,NOT ENOUGH INFO,James VI and I was a lackey.,True
random,NOT ENOUGH INFO,Random selection,REFUTES,CHiPs is based on nothing.,False
random,NOT ENOUGH INFO,Random selection,REFUTES,Chile is a city.,False
random,REFUTES,Random selection,SUPPORTS,Fidel Castro transferred his responsibilities to his brother.,False
random,NOT ENOUGH INFO,Random selection,REFUTES,Lou Gehrig received no votes on the Major League Baseball All-Century Team in 1999.,False
random,REFUTES,Random selection,REFUTES,Dilwale Dulhania Le Jayenge was all filmed in China.,True
random,REFUTES,Random selection,SUPPORTS,Richard Alf was one of the founders of San Diego Comic-Con.,False
random,NOT ENOUGH INFO,Random selection,NOT ENOUGH INFO,Aleister Crowley denied English citizenship.,True
random,REFUTES,Random selection,SUPPORTS,The Mighty Ducks was distributed by a subsidiary of Walt Disney Studios.,False
random,NOT ENOUGH INFO,Random selection,SUPPORTS,"A director of plays was José Ferrer,",False
random,SUPPORTS,Random selection,SUPPORTS,Omar Khadr was convicted.,True
random,NOT ENOUGH INFO,Random selection,NOT ENOUGH INFO,Pearl Jam is considered to be one of the most diverse bands of its time.,True
random,REFUTES,Random selection,NOT ENOUGH INFO,Off the Wall won its singer a Billboard Music Award.,False
random,NOT ENOUGH INFO,Random selection,SUPPORTS,Joe Wicks is played by Paul Nicholls.,False
random,REFUTES,Random selection,REFUTES,Always premiered in the Paleozoic Era.,True
random,NOT ENOUGH INFO,Random selection,SUPPORTS,Liverpool is a tourist destination because of The Beatles.,False
random,NOT ENOUGH INFO,Random selection,NOT ENOUGH INFO,Psych is a required course in California.,True
random,REFUTES,Random selection,REFUTES,Juventus F.C. is the second oldest ultimate frisbee club in Italy.,True
random,SUPPORTS,Random selection,REFUTES,Baz Luhrmann's film Australia was only rejected to be starred in by Hugh Jackman.,False
random,REFUTES,Random selection,SUPPORTS,"Syracuse, New York, had a metropolitan area with a population of more than 600,000 residents according to the 2010 Census.",False
random,REFUTES,Random selection,REFUTES,Andrew Kevin Walker is a cat.,True
random,SUPPORTS,Random selection,SUPPORTS,Aarhus is the place of Aarhus municipality.,True
random,SUPPORTS,Random selection,SUPPORTS,Rob Sheridan is an American photographer.,True
random,SUPPORTS,Random selection,NOT ENOUGH INFO,Men in Black II is an award-winning film.,False
random,SUPPORTS,Random selection,REFUTES,Invasion literature was influential in Spain in shaping popular perceptions.,False
random,REFUTES,Random selection,NOT ENOUGH INFO,Paul Nicholls played Batman.,False
random,SUPPORTS,Random selection,SUPPORTS,David Spade starred in Tommy Boy.,True
random,REFUTES,Random selection,SUPPORTS,Osamu Tezuka was a child.,False
random,NOT ENOUGH INFO,Random selection,NOT ENOUGH INFO,Ashton Kutcher was co-stars with Emma Watson.,True
random,REFUTES,Random selection,NOT ENOUGH INFO,Ashley Cole is Iranian.,False
random,SUPPORTS,Random selection,REFUTES,Tie Your Mother Down was only ever released as part of an album instead of as a single.,False
random,REFUTES,Random selection,NOT ENOUGH INFO,Samwell Tarly is a protagonist.,False
random,REFUTES,Random selection,REFUTES,In the End was released through Interscope Records.,True
random,SUPPORTS,Random selection,SUPPORTS,Wildfang is a US-based women's apparel company featuring hats that are tomboyish in style.,True
random,REFUTES,Random selection,REFUTES,The 100 is not a TV series following a group of teens.,True
random,REFUTES,Random selection,SUPPORTS,Pirates of the Caribbean is in Disneyland Paris.,False
random,NOT ENOUGH INFO,Random selection,REFUTES,Paramore is Texan.,False
random,NOT ENOUGH INFO,Random selection,NOT ENOUGH INFO,Happiness in Slavery is a gospel song by Nine Inch Nails.,True
random,NOT ENOUGH INFO,Random selection,SUPPORTS,Alice Cooper's career has been long.,False
random,NOT ENOUGH INFO,Random selection,REFUTES,Kellyanne Conway has not been embroiled in a series of controversies.,False
random,NOT ENOUGH INFO,Random selection,REFUTES,The Sterile Cuckoo was directed by Tim Burton.,False
random,REFUTES,Random selection,REFUTES,Wilhelmina Slater is a fictional setting.,True
random,SUPPORTS,Random selection,REFUTES,"Dan O'Bannon graduated college on September 30th, 1946.",False
random,NOT ENOUGH INFO,Random selection,NOT ENOUGH INFO,José Ferrer was a director of government projects.,True
random,NOT ENOUGH INFO,Random selection,SUPPORTS,Mount Rushmore was made.,False
random,NOT ENOUGH INFO,Random selection,REFUTES,Microbiologists typically avoid investigating infectious microorganisms.,False
random,REFUTES,Random selection,SUPPORTS,Joe Rogan moved to Los Angeles.,False
random,NOT ENOUGH INFO,Random selection,NOT ENOUGH INFO,Soyuz was part of the Indian space program.,True
random,NOT ENOUGH INFO,Random selection,SUPPORTS,Off the Wall is a record by Michael Jackson.,False
random,NOT ENOUGH INFO,Random selection,REFUTES,Winter's Tale is only a movie.,False
random,REFUTES,Random selection,SUPPORTS,Wildfang was founded by two people.,False
random,NOT ENOUGH INFO,Random selection,REFUTES,Brazzers is a pornographic festival.,False
random,SUPPORTS,Random selection,NOT ENOUGH INFO,Tenacious D started in May of 1994.,False
random,NOT ENOUGH INFO,Random selection,SUPPORTS,Joe Walsh was inducted in 2001.,False
random,REFUTES,Random selection,SUPPORTS,The Greek language is spoken in Albania.,False
random,REFUTES,Random selection,SUPPORTS,New Orleans Pelicans play in the NBA in the Western Conference.,False
random,REFUTES,Random selection,REFUTES,Ludwig van Beethoven was part of the jam band era.,True
random,NOT ENOUGH INFO,Random selection,REFUTES,A Milli is a building by a hip hop recording artist.,False
random,SUPPORTS,Random selection,NOT ENOUGH INFO,Bradley Fuller is an American filmmaker.,False
random,NOT ENOUGH INFO,Random selection,SUPPORTS,Brick (film) is a film.,False
random,SUPPORTS,Random selection,SUPPORTS,"On September 26, 1937 Bessie Smith died.",True
random,REFUTES,Random selection,NOT ENOUGH INFO,Uranium-235 was discovered by a governor who was born in August.,False
random,NOT ENOUGH INFO,Random selection,SUPPORTS,Acting is John Krasinski's career.,False
random,REFUTES,Random selection,SUPPORTS,Knocked Up was released around the world.,False
random,NOT ENOUGH INFO,Random selection,REFUTES,Homer Hickman was incapable of writing anything for the Josh Thurlow novels.,False
random,REFUTES,Random selection,NOT ENOUGH INFO,Vietnam is the 14th most famous country in the world.,False
random,SUPPORTS,Random selection,NOT ENOUGH INFO,Home for the Holidays stars an American director.,False
random,NOT ENOUGH INFO,Random selection,SUPPORTS,"Beaverton, Oregon is a city in Washington County.",False
random,NOT ENOUGH INFO,Random selection,REFUTES,Congressional Space Medal of Honor is awarded based on recommendations from the Administrator of Office Depot.,False
random,NOT ENOUGH INFO,Random selection,REFUTES,David Packouz refused to be an entrepreneur.,False
random,SUPPORTS,Random selection,SUPPORTS,Sheryl Lee reprised her role of a woman.,True
random,REFUTES,Random selection,NOT ENOUGH INFO,The New York City Landmarks Preservation Commission includes a priest.,False
random,NOT ENOUGH INFO,Random selection,SUPPORTS,Same Old Love is a work of music.,False
random,NOT ENOUGH INFO,Random selection,NOT ENOUGH INFO,Soul Food is the only comedy film to ever exist.,True
random,NOT ENOUGH INFO,Random selection,NOT ENOUGH INFO,"Camden, New Jersey is in a mall.",True
random,NOT ENOUGH INFO,Random selection,NOT ENOUGH INFO,Liam Neeson has presented an Academy Award.,True
random,NOT ENOUGH INFO,Random selection,NOT ENOUGH INFO,Stanley Williams was Catholic.,True
random,SUPPORTS,Random selection,NOT ENOUGH INFO,In a Lonely Place was based on a mystery by Dorthy B. Hughes,False
random,NOT ENOUGH INFO,Random selection,REFUTES,"Recovery only has one singer on it, Drake.",False
random,NOT ENOUGH INFO,Random selection,NOT ENOUGH INFO,Henry VIII (TV serial) stars a Venezuelan actor.,True
random,REFUTES,Random selection,SUPPORTS,Aparshakti Khurana appeared in a film.,False
random,REFUTES,Random selection,NOT ENOUGH INFO,The Cretaceous ended with a large mass extinction in 2010.,False
random,SUPPORTS,Random selection,NOT ENOUGH INFO,Papua was formerly West Irian and was cultured.,False
random,NOT ENOUGH INFO,Random selection,REFUTES,Wentworth Miller made his screenwriting debut with the 80s film Stoker.,False
random,NOT ENOUGH INFO,Random selection,REFUTES,Mogadishu is only a business.,False
random,REFUTES,Random selection,REFUTES,Yara Shahidi is 32 years old.,True
random,NOT ENOUGH INFO,Random selection,REFUTES,Always premiered in 1492.,False
random,SUPPORTS,Random selection,REFUTES,Rachel Green is a fictional hat.,False
random,REFUTES,Random selection,SUPPORTS,Henry VIII (TV serial) features a film and television actor in a leading role.,False
random,REFUTES,Random selection,REFUTES,Simón Bolívar's full name is Simón Bolívar.,True
random,REFUTES,Random selection,REFUTES,Matthew Gray Gubler was born in 1984.,True
random,NOT ENOUGH INFO,Random selection,NOT ENOUGH INFO,Folklore includes tigers.,True
random,NOT ENOUGH INFO,Random selection,SUPPORTS,One Turkic language was the Chagatai language.,False
random,REFUTES,Random selection,REFUTES,Hot Right Now is from the author Bob Stanley.,True
random,SUPPORTS,Random selection,REFUTES,The Mighty Ducks was produced by Waluigi.,False
random,NOT ENOUGH INFO,Random selection,REFUTES,The Adventures of Pluto Nash was directed by Ron Underwood in 2006.,False
random,REFUTES,Random selection,NOT ENOUGH INFO,The New York Knicks compete in the National League.,False
random,NOT ENOUGH INFO,Random selection,REFUTES,"Yara Shahidi was born on February 10, 1900.",False
random,NOT ENOUGH INFO,Random selection,SUPPORTS,Shane Black was born in 1961.,False
random,NOT ENOUGH INFO,Random selection,SUPPORTS,Mud stars Matthew McConaughey.,False
random,SUPPORTS,Random selection,SUPPORTS,DNA features songs.,True
random,REFUTES,Random selection,REFUTES,Mary of Teck was never queen mother.,True
random,NOT ENOUGH INFO,Random selection,REFUTES,Global warming will result in the expansion of permafrost.,False
random,SUPPORTS,Random selection,SUPPORTS,Harris Jayaraj is a film composer.,True
random,REFUTES,Random selection,NOT ENOUGH INFO,Drake Bell is a brother.,False
random,NOT ENOUGH INFO,Random selection,SUPPORTS,Seohyun was born in 1991.,False
random,REFUTES,Random selection,NOT ENOUGH INFO,Kesha is Jewish.,False
random,SUPPORTS,Random selection,REFUTES,Saxony is a horse.,False
random,SUPPORTS,Random selection,SUPPORTS,2016 Tour de France was a race.,True
random,SUPPORTS,Random selection,REFUTES,Ingushetia was incapable of being established after Chechen-Ingush ASSR split into two.,False
random,REFUTES,Random selection,SUPPORTS,The ruins of the ancient Roman town of Pompeii lie near Naples.,False
random,SUPPORTS,Random selection,REFUTES,The horse has shrunk in size as it evolved.,False
random,NOT ENOUGH INFO,Random selection,REFUTES,Cheese in the Trap (TV series) comes from India.,False
random,SUPPORTS,Random selection,REFUTES,James Earl Jones was not a voice actor in The Lion King.,False
random,REFUTES,Random selection,NOT ENOUGH INFO,Tim McGraw played a role in a 2009 American biographical sports drama movie.,False
random,REFUTES,Random selection,NOT ENOUGH INFO,Victoria Palace Theatre is opposite Victoria Station and is a place of culture.,False
random,SUPPORTS,Random selection,NOT ENOUGH INFO,Colin Kaepernick is a starter for the San Francisco Giants.,False
random,SUPPORTS,Random selection,SUPPORTS,Buffy Summers appears in a book.,True
random,NOT ENOUGH INFO,Random selection,SUPPORTS,Britt Robertson is an entertainer.,False
random,NOT ENOUGH INFO,Random selection,NOT ENOUGH INFO,The mother of Osamu Tezuka had to erase pages in his notebook.,True
random,REFUTES,Random selection,REFUTES,Aarhus is the second-largest city in Germany.,True
random,NOT ENOUGH INFO,Random selection,SUPPORTS,Sidse Babett Knudsen does television work.,False
random,SUPPORTS,Random selection,REFUTES,Taylor Lautner appeared in The Bernie Mac Show in 2001.,False
random,NOT ENOUGH INFO,Random selection,REFUTES,Exercise raises resting heart rate in the long term.,False
random,SUPPORTS,Random selection,REFUTES,Mary-Kate Olsen and Ashley Olsen are incapable of being fashion designers.,False
random,NOT ENOUGH INFO,Random selection,NOT ENOUGH INFO,Barry Van Dyke is an English actor.,True
random,REFUTES,Random selection,SUPPORTS,Anne Sullivan was born in 1866.,False
random,REFUTES,Random selection,SUPPORTS,Charles Manson led a sort-of-commune that came into being in California in the late 1960s.,False
random,REFUTES,Random selection,SUPPORTS,"Alice Cooper is a singer, songwriter and actor.",False
random,SUPPORTS,Random selection,REFUTES,Tamerlan Tsarnaev was an only child.,False
