method,label,rationale,true_label,claim,correct
random,NOT ENOUGH INFO,Random selection,NOT ENOUGH INFO,"Alexandra Daddario was bullied on March 16, 1986.",True
random,SUPPORTS,Random selection,SUPPORTS,Reign Over Me was released in 2007.,True
random,NOT ENOUGH INFO,Random selection,REFUTES,First Motion Picture Unit produced zero films.,False
random,NOT ENOUGH INFO,Random selection,REFUTES,"Fabian Nicieza was born December 3, 1967.",False
random,REFUTES,Random selection,REFUTES,The Mighty Ducks was distributed only by Netflix.,True
random,SUPPORTS,Random selection,SUPPORTS,A performance in The Godfather Part II was nominated for an Academy Award for Best Actor.,True
random,SUPPORTS,Random selection,REFUTES,The 100 does not follow character Clarke Griffin.,False
random,NOT ENOUGH INFO,Random selection,SUPPORTS,Saturn Corporation is known by another name.,False
random,NOT ENOUGH INFO,Random selection,SUPPORTS,The Concert for Bangladesh is seen as a highly successful and influential humanitarian aid project.,False
random,REFUTES,Random selection,SUPPORTS,Daggering has connections to a genre of Jamaican music.,False
random,REFUTES,Random selection,REFUTES,"Sidse Babett Knudsen died on November 22nd, 1967.",True
random,SUPPORTS,Random selection,REFUTES,Luke Cage did not appear in a comic book series.,False
random,SUPPORTS,Random selection,REFUTES,Fortunes of War omits Kenneth Branagh.,False
random,REFUTES,Random selection,REFUTES,Riddick is in a documentary.,True
random,SUPPORTS,Random selection,NOT ENOUGH INFO,Harold Macmillan only served as the President of the United Kingdom.,False
random,SUPPORTS,Random selection,SUPPORTS,Shadowhunters debuted on Freeform.,True
random,NOT ENOUGH INFO,Random selection,SUPPORTS,Juventus F.C. is the second oldest association football (soccer) club in Italy.,False
random,REFUTES,Random selection,NOT ENOUGH INFO,The Mirny (sloop-of-war) was a 20-gun warship.,False
random,SUPPORTS,Random selection,REFUTES,Margaret Thatcher was not a politician.,False
random,SUPPORTS,Random selection,REFUTES,Trevor Griffiths was born on Mars.,False
random,SUPPORTS,Random selection,REFUTES,"Beaverton, Oregon's city center is in decline.",False
random,SUPPORTS,Random selection,SUPPORTS,Sebastian Stan had a role in a TV production.,True
random,REFUTES,Random selection,SUPPORTS,Kelly Preston starred in The Cat in the Hat.,False
random,REFUTES,Random selection,SUPPORTS,Papua was formerly called a different name.,False
random,NOT ENOUGH INFO,Random selection,REFUTES,A Floppy disk is composed of a thin and flexible electronic storage medium.,False
random,NOT ENOUGH INFO,Random selection,REFUTES,Rhythm Nation was incapable of being performed on Britain's Got Talent.,False
random,REFUTES,Random selection,SUPPORTS,Michigan is one of the fifty states in the United States.,False
random,SUPPORTS,Random selection,REFUTES,Tatum O'Neal married a professional golf player.,False
random,NOT ENOUGH INFO,Random selection,NOT ENOUGH INFO,The Closer's final season was its most-watched season.,True
random,SUPPORTS,Random selection,SUPPORTS,Always is a film.,True
random,NOT ENOUGH INFO,Random selection,REFUTES,Stadium Arcadium was released in or before 1997.,False
random,REFUTES,Random selection,SUPPORTS,Pearl Jam is a band.,False
random,REFUTES,Random selection,NOT ENOUGH INFO,Henry II of France announced an untimely death.,False
random,REFUTES,Random selection,SUPPORTS,Andrew Kevin Walker is from America.,False
random,NOT ENOUGH INFO,Random selection,SUPPORTS,Topman has outlets in six cities and towns in Ireland.,False
random,NOT ENOUGH INFO,Random selection,SUPPORTS,Ann Richards was professionally involved in politics.,False
random,SUPPORTS,Random selection,REFUTES,Yale University's alumni includes zero U.S. Supreme Court Justices.,False
random,REFUTES,Random selection,SUPPORTS,Birthday Song (2 Chainz song) was produced by a producer.,False
random,REFUTES,Random selection,REFUTES,Recovery is an Eminem song.,True
random,NOT ENOUGH INFO,Random selection,SUPPORTS,Anne Sullivan was an American teacher.,False
random,NOT ENOUGH INFO,Random selection,NOT ENOUGH INFO,Youtube is a location connected to the Internet that maintains one or more pages on the World Wide Web.,True
random,REFUTES,Random selection,NOT ENOUGH INFO,Residents of Basildon work in Central London.,False
random,NOT ENOUGH INFO,Random selection,REFUTES,Kendall Jenner is a driver.,False
random,REFUTES,Random selection,REFUTES,The Washington Wizards lost the division title in 2017.,True
random,REFUTES,Random selection,REFUTES,Michelin Guides were published for the first time in 1995.,True
random,NOT ENOUGH INFO,Random selection,NOT ENOUGH INFO,Topman is part of a retailing company.,True
random,SUPPORTS,Random selection,SUPPORTS,Guatemala's civil war had two sides.,True
random,REFUTES,Random selection,NOT ENOUGH INFO,Roland Emmerich is a collector of Picasso paintings.,False
random,SUPPORTS,Random selection,NOT ENOUGH INFO,2016 Tour de France was a 21-stage relay.,False
random,REFUTES,Random selection,NOT ENOUGH INFO,Topman is an independent company.,False
random,REFUTES,Random selection,SUPPORTS,Marvel vs. Capcom: Infinite is a work.,False
random,NOT ENOUGH INFO,Random selection,NOT ENOUGH INFO,Black Canary is a character in works.,True
random,NOT ENOUGH INFO,Random selection,SUPPORTS,Michaela Watkins is a woman who acts.,False
random,REFUTES,Random selection,REFUTES,Shane McMahon won the Hardcore Championship thrice.,True
random,NOT ENOUGH INFO,Random selection,SUPPORTS,"Larry the Cable Guy series finale aired on August 28th, 2013.",False
random,SUPPORTS,Random selection,SUPPORTS,Miranda Otto began her acting career at age 18.,True
random,REFUTES,Random selection,SUPPORTS,The Los Angeles Rams is a team that Terry Crews played for.,False
random,REFUTES,Random selection,REFUTES,"Earl Scruggs was born on May 22nd, 1992.",True
random,SUPPORTS,Random selection,NOT ENOUGH INFO,Robert Palmer (writer) has produced jazz recordings.,False
random,SUPPORTS,Random selection,SUPPORTS,Hot Right Now is off of a DJ Fresh album.,True
random,NOT ENOUGH INFO,Random selection,REFUTES,Steve Ditko has only ever studied at Emerson.,False
random,NOT ENOUGH INFO,Random selection,SUPPORTS,Gaga's second consecutive number-one record in the United States was Artpop.,False
random,SUPPORTS,Random selection,NOT ENOUGH INFO,Tamerlan Tsarnaev has been to the dentist.,False
random,REFUTES,Random selection,REFUTES,Guillermo del Toro died in 1964.,True
random,NOT ENOUGH INFO,Random selection,NOT ENOUGH INFO,"Luis Fonsi's given name, which he does not use when performing, is Luis Alfonso Rodríguez López-Cepero.",True
random,REFUTES,Random selection,REFUTES,Terry Crews was only a quarterback.,True
random,SUPPORTS,Random selection,SUPPORTS,Shane McMahon won the European Championship once.,True
random,SUPPORTS,Random selection,REFUTES,In the Cretaceous pterosaurs and large marine reptiles prospered and continued their survival.,False
random,NOT ENOUGH INFO,Random selection,NOT ENOUGH INFO,Kendall Jenner was in Time magazine.,True
random,SUPPORTS,Random selection,NOT ENOUGH INFO,I Kissed a Girl is part of Katy Perry's second studio jazz album.,False
random,NOT ENOUGH INFO,Random selection,SUPPORTS,Tim McGraw was in a movie with Reese Witherspoon.,False
random,REFUTES,Random selection,NOT ENOUGH INFO,Physical entities are distinguished by life.,False
random,REFUTES,Random selection,REFUTES,Hedda Gabler's world premiere took place in Schwabing.,True
random,NOT ENOUGH INFO,Random selection,REFUTES,Francis I of France was the father of Francis of the Large Nose.,False
random,REFUTES,Random selection,REFUTES,Vedam is a 2010 South African romance film.,True
random,NOT ENOUGH INFO,Random selection,SUPPORTS,The Bahamas is an internationally recognized state that comprises a series of islands that form an archipelago.,False
random,NOT ENOUGH INFO,Random selection,REFUTES,Jens Stolenberg only held the office of Prime Minister from 2000 to 2001.,False
random,NOT ENOUGH INFO,Random selection,REFUTES,Marjorie Gross is illiterate.,False
random,SUPPORTS,Random selection,NOT ENOUGH INFO,Tinker Tailor Soldier Spy stars Tom Cruise.,False
random,SUPPORTS,Random selection,NOT ENOUGH INFO,L.A. Reid has served as the chairman of an Egyptian record label group formed in 1998.,False
random,NOT ENOUGH INFO,Random selection,REFUTES,Cher is Cher's eighteenth orchestra.,False
random,SUPPORTS,Random selection,REFUTES,Psych is a drama and comedy that aired in 2004.,False
random,SUPPORTS,Random selection,REFUTES,"Lost lasted from October 14, 1985 to December 13, 1999.",False
random,NOT ENOUGH INFO,Random selection,SUPPORTS,Don Bradman's status as a national icon was recognized.,False
random,NOT ENOUGH INFO,Random selection,NOT ENOUGH INFO,Princess Mononoke is only a Ghibli TV series.,True
random,NOT ENOUGH INFO,Random selection,REFUTES,X-Men: Apocalypse was cancelled in 2013.,False
random,REFUTES,Random selection,REFUTES,The album Cher was created only by Bon Jovi.,True
random,NOT ENOUGH INFO,Random selection,NOT ENOUGH INFO,Veeru Devgan is Indian and Scottish.,True
random,SUPPORTS,Random selection,REFUTES,I Kissed a Girl was recorded by Brittany Spears.,False
random,SUPPORTS,Random selection,NOT ENOUGH INFO,Rick Rosner wrote the TV series that CHiPs is based on.,False
random,REFUTES,Random selection,SUPPORTS,"Camden, New Jersey is the home of a university that was founded as the South Jersey Law School in 1926.",False
random,NOT ENOUGH INFO,Random selection,SUPPORTS,Harvard University is the first University in the U.S.,False
random,NOT ENOUGH INFO,Random selection,NOT ENOUGH INFO,Despicable Me 2 was animated by Illumination Mac Guff in 2014.,True
random,SUPPORTS,Random selection,REFUTES,Bea Arthur was solely German.,False
random,SUPPORTS,Random selection,SUPPORTS,The Hanford Site contributes to the LIGO Hanford Observatory.,True
random,REFUTES,Random selection,NOT ENOUGH INFO,The horse used to have five toes.,False
random,NOT ENOUGH INFO,Random selection,SUPPORTS,Nicholas Brody is a character on Homeland.,False
random,SUPPORTS,Random selection,REFUTES,Brad Wilk died before helping to co-found Rage.,False
random,SUPPORTS,Random selection,NOT ENOUGH INFO,Sandra Bullock was fired by ABC.,False
random,NOT ENOUGH INFO,Random selection,NOT ENOUGH INFO,Luke Cage was featured as the title character of a comic book zero times.,True
random,NOT ENOUGH INFO,Random selection,REFUTES,Peking University is in a unitary sovereign state that's located in East Asia.,False
random,NOT ENOUGH INFO,Random selection,SUPPORTS,The Sterile Cuckoo was adapted from The Sterile Cuckoo.,False
random,SUPPORTS,Random selection,NOT ENOUGH INFO,The Concert for Bangladesh generated awareness and considerable balloons.,False
random,NOT ENOUGH INFO,Random selection,SUPPORTS,Shinji Mikami is a producer.,False
random,SUPPORTS,Random selection,NOT ENOUGH INFO,The Chagatai language was spoken in Turkey and Kazakhstan.,False
random,SUPPORTS,Random selection,REFUTES,Aaron Burr murdered one of the American Founding Fathers.,False
random,SUPPORTS,Random selection,REFUTES,English people are unconnected to the Saxons.,False
random,SUPPORTS,Random selection,NOT ENOUGH INFO,Moonlight's filming began in a store.,False
random,REFUTES,Random selection,SUPPORTS,Baz Luhrmann's film has different genres.,False
random,NOT ENOUGH INFO,Random selection,NOT ENOUGH INFO,Flaked was renewed for a seven episode season.,True
random,NOT ENOUGH INFO,Random selection,REFUTES,"Camden, New Jersey has no universities.",False
random,NOT ENOUGH INFO,Random selection,SUPPORTS,Tim McGraw had a supporting role in The Blind Side.,False
random,REFUTES,Random selection,SUPPORTS,Avenged Sevenfold's fourth studio album is Avenged Sevenfold.,False
random,SUPPORTS,Random selection,REFUTES,"Harold Macmillan died on December 29, 1886.",False
random,NOT ENOUGH INFO,Random selection,NOT ENOUGH INFO,Underdog features the voice talents of Angelina Jolie.,True
random,NOT ENOUGH INFO,Random selection,NOT ENOUGH INFO,"Dan O'Bannon was born on September 30th, 1946 in a log cabin.",True
random,SUPPORTS,Random selection,NOT ENOUGH INFO,Henry II of France is a husband.,False
random,SUPPORTS,Random selection,SUPPORTS,Augustus died in 14 AD.,True
random,REFUTES,Random selection,SUPPORTS,A&E was previously the Arts & Entertainment Network.,False
random,SUPPORTS,Random selection,REFUTES,Speech recognition is ignored in all fields.,False
random,REFUTES,Random selection,REFUTES,Annette Badland was unable to ever join a BBC science fiction series.,True
random,SUPPORTS,Random selection,NOT ENOUGH INFO,Fabian Nicieza worked on Guardians of the Galaxy.,False
random,NOT ENOUGH INFO,Random selection,NOT ENOUGH INFO,Matthias Corvinus had a daughter called the Bibliotheca Corviniana.,True
random,SUPPORTS,Random selection,SUPPORTS,Finding Dory was directed by someone.,True
random,NOT ENOUGH INFO,Random selection,REFUTES,Starrcade was never broadcast via pay-per-view television.,False
random,SUPPORTS,Random selection,NOT ENOUGH INFO,Wentworth Miller made his screenwriting debut with the top grossing thriller film Stoker.,False
random,REFUTES,Random selection,REFUTES,Anne Rice was born in New Mexico.,True
random,NOT ENOUGH INFO,Random selection,REFUTES,Homo sapiens live on the fourth planet from the Sun.,False
random,REFUTES,Random selection,REFUTES,"There are not rumors that Augustus' wife, Livia, poisoned him.",True
random,SUPPORTS,Random selection,NOT ENOUGH INFO,Highway to Heaven began airing in Canada.,False
random,SUPPORTS,Random selection,NOT ENOUGH INFO,Chile is in the northern part of the western hemisphere.,False
random,REFUTES,Random selection,REFUTES,Ripon College is in hell.,True
random,REFUTES,Random selection,NOT ENOUGH INFO,International students come to the University of Mississippi from 90 nations including Britain.,False
random,REFUTES,Random selection,NOT ENOUGH INFO,Soyuz was designed between 1961 and 1964.,False
random,SUPPORTS,Random selection,NOT ENOUGH INFO,Noel Fisher starred in True Detective.,False
random,NOT ENOUGH INFO,Random selection,NOT ENOUGH INFO,Regina King has received a Critics' Choice Television Award.,True
random,NOT ENOUGH INFO,Random selection,REFUTES,A Milli is a song by a jazz recording artist.,False
random,NOT ENOUGH INFO,Random selection,NOT ENOUGH INFO,Fred Armisen is a screenwriter for television series.,True
random,NOT ENOUGH INFO,Random selection,SUPPORTS,Kim Jong-il is designated Eternal Chairman of the National Defence Commission.,False
random,SUPPORTS,Random selection,SUPPORTS,Miracle at St. Anna is set primarily in Europe.,True
random,NOT ENOUGH INFO,Random selection,NOT ENOUGH INFO,Jenna Jameson only worked as a professional actress.,True
random,NOT ENOUGH INFO,Random selection,REFUTES,Leonard Nimoy was not in Civilization IV.,False
random,NOT ENOUGH INFO,Random selection,SUPPORTS,Kentucky is known for bluegrass music.,False
random,NOT ENOUGH INFO,Random selection,NOT ENOUGH INFO,Derek Hough has worked with a J-pop singer.,True
random,SUPPORTS,Random selection,NOT ENOUGH INFO,David Packouz is a grandfather.,False
random,REFUTES,Random selection,SUPPORTS,Ingushetia was established on June.,False
random,NOT ENOUGH INFO,Random selection,SUPPORTS,There are film scores in existence that have been composed by Phillip Glass.,False
random,REFUTES,Random selection,SUPPORTS,Ed Wood is about the eponymous actor.,False
random,NOT ENOUGH INFO,Random selection,SUPPORTS,There was a song performed on Glee called Rhythm Nation.,False
random,NOT ENOUGH INFO,Random selection,NOT ENOUGH INFO,Men in Black II is a financial success.,True
random,REFUTES,Random selection,NOT ENOUGH INFO,Bea Arthur was a cigarette lobbyist.,False
random,SUPPORTS,Random selection,NOT ENOUGH INFO,Nicholas Brody was born in 1963.,False
random,NOT ENOUGH INFO,Random selection,SUPPORTS,The Bloods are identified by the color worn by their members.,False
random,REFUTES,Random selection,REFUTES,"Gray Matter Interactive Studios, Inc. was a board game developer.",True
random,NOT ENOUGH INFO,Random selection,NOT ENOUGH INFO,The Columbia River has ships and barges for trade.,True
random,REFUTES,Random selection,REFUTES,Ed Wood is about the eponymous wrestler.,True
random,REFUTES,Random selection,REFUTES,L.A. Reid was turned down for the role of CEO of an American record label owned by Sony Music Entertainment.,True
random,SUPPORTS,Random selection,NOT ENOUGH INFO,Eric Church has won 11 Grammy Awards for singing country music.,False
random,REFUTES,Random selection,SUPPORTS,Albert S. Ruddy is not born in India.,False
random,NOT ENOUGH INFO,Random selection,NOT ENOUGH INFO,Juventus F.C. has worn a red-and-tan away uniform since 1903.,True
random,NOT ENOUGH INFO,Random selection,REFUTES,The History of Earth dates back more than 5 billion years.,False
random,NOT ENOUGH INFO,Random selection,NOT ENOUGH INFO,Diwali spiritually signifies good over evil.,True
random,NOT ENOUGH INFO,Random selection,REFUTES,Knocked Up was released worldwide in 2003.,False
random,NOT ENOUGH INFO,Random selection,SUPPORTS,Al Jardine sang lead vocals in a band.,False
random,NOT ENOUGH INFO,Random selection,REFUTES,You Belong with Me has yet to be performed as part of a tour.,False
random,NOT ENOUGH INFO,Random selection,SUPPORTS,Keith Urban is an Australian country music artist's second studio album.,False
random,NOT ENOUGH INFO,Random selection,NOT ENOUGH INFO,A Milli is a book by a hip hop recording artist.,True
random,SUPPORTS,Random selection,SUPPORTS,Match Point has been compared to another Woody Allen film.,True
random,REFUTES,Random selection,NOT ENOUGH INFO,"Bhagat Singh was from New Delhi, India.",False
random,SUPPORTS,Random selection,REFUTES,Sidse Babett Knudsen works in radio.,False
random,SUPPORTS,Random selection,SUPPORTS,Bonn is the birthplace of Ludwig van Beethoven.,True
random,SUPPORTS,Random selection,NOT ENOUGH INFO,Colin Kaepernick was backup to Tom Brady.,False
random,NOT ENOUGH INFO,Random selection,NOT ENOUGH INFO,Despicable Me 2 was produced exclusively for Yahoo.,True
random,SUPPORTS,Random selection,SUPPORTS,Sora (Kingdom Hearts) went on an adventure with a Disney character.,True
random,SUPPORTS,Random selection,NOT ENOUGH INFO,The Bee Gees wrote their own autobiographies.,False
random,SUPPORTS,Random selection,NOT ENOUGH INFO,Tinker Tailor Soldier Spy stars Hillary Clinton.,False
random,NOT ENOUGH INFO,Random selection,NOT ENOUGH INFO,Topman has stores throughout Germany.,True
random,SUPPORTS,Random selection,NOT ENOUGH INFO,"Camden, New Jersey is the home of a sports team.",False
random,NOT ENOUGH INFO,Random selection,NOT ENOUGH INFO,DJ Quik is a rapper and music producer.,True
random,REFUTES,Random selection,NOT ENOUGH INFO,Star Trek: Discovery is the first series since Gene Roddenberry's retirement.,False
random,SUPPORTS,Random selection,NOT ENOUGH INFO,One cartoonist was Steve Ditko.,False
random,SUPPORTS,Random selection,SUPPORTS,Tamerlan Tsarnaev has been in a shootout.,True
random,NOT ENOUGH INFO,Random selection,SUPPORTS,Lockheed Martin's CEO is now a person born in December.,False
random,NOT ENOUGH INFO,Random selection,NOT ENOUGH INFO,Murda Beatz is a hip hop and jazz record producer.,True
random,SUPPORTS,Random selection,REFUTES,2016 Tour de France was a 21-stage musical.,False
random,SUPPORTS,Random selection,NOT ENOUGH INFO,The CONCACAF Champions League is organized for football clubs in the evil realm.,False
random,SUPPORTS,Random selection,REFUTES,Duane Chapman is from Texas.,False
random,SUPPORTS,Random selection,REFUTES,Roswell is exclusively a mystery TV series.,False
random,SUPPORTS,Random selection,NOT ENOUGH INFO,Veeru Devgan is a stunt and dance choreographer.,False
random,REFUTES,Random selection,NOT ENOUGH INFO,Kleshas are part of Hinduism.,False
random,NOT ENOUGH INFO,Random selection,NOT ENOUGH INFO,Tim McGraw acted in Venezuela.,True
random,REFUTES,Random selection,REFUTES,Humphrey Bogart was not ranked greatest male star of Classic American cinema in 1999.,True
random,SUPPORTS,Random selection,NOT ENOUGH INFO,Winter's Tale is an allegory for the life of an American novelist.,False
random,NOT ENOUGH INFO,Random selection,REFUTES,Saturn is a moon.,False
random,REFUTES,Random selection,NOT ENOUGH INFO,Fidel Castro has a sister.,False
random,REFUTES,Random selection,REFUTES,Michael B. Jordan was born in 2005.,True
random,REFUTES,Random selection,SUPPORTS,Aerobic exercise lowers resting heart rate in the long term.,False
random,REFUTES,Random selection,NOT ENOUGH INFO,The Hindu Kush is a mountain range between India and Pakistan.,False
random,REFUTES,Random selection,REFUTES,Mickey Rourke has only appeared in films based on real people.,True
random,REFUTES,Random selection,REFUTES,Victoria Palace Theatre is in an inner New York borough.,True
random,REFUTES,Random selection,NOT ENOUGH INFO,Don Bradman's status as a national icon was recognized after his school years.,False
random,SUPPORTS,Random selection,SUPPORTS,"The Lincoln-Douglas debates happened in Freeport, Illinois.",True
random,SUPPORTS,Random selection,SUPPORTS,"The Prowler was created by Stan Lee, John Buscema, and Jim Morrison.",True
random,SUPPORTS,Random selection,REFUTES,Stan Beeman is only in modern comedies.,False
random,SUPPORTS,Random selection,REFUTES,Eva Green made her film debut in a film directed by Robin Williams.,False
random,REFUTES,Random selection,REFUTES,Melancholia stars only men.,True
random,NOT ENOUGH INFO,Random selection,NOT ENOUGH INFO,David Packouz is a Gemini.,True
random,SUPPORTS,Random selection,NOT ENOUGH INFO,Musical arts has been significantly impacted by Appropriation (art).,False
random,NOT ENOUGH INFO,Random selection,NOT ENOUGH INFO,Shadowhunters began its second season in Zambia.,True
random,SUPPORTS,Random selection,SUPPORTS,Private Lives is a comedy.,True
random,SUPPORTS,Random selection,NOT ENOUGH INFO,CHiPs is an American romance film.,False
random,NOT ENOUGH INFO,Random selection,REFUTES,PacSun barely sells products designed for teens.,False
random,NOT ENOUGH INFO,Random selection,NOT ENOUGH INFO,Daggering is nonconformist.,True
random,NOT ENOUGH INFO,Random selection,SUPPORTS,Yandex is a website.,False
random,NOT ENOUGH INFO,Random selection,REFUTES,The Daily Show described itself as a credible news program.,False
random,NOT ENOUGH INFO,Random selection,NOT ENOUGH INFO,Colombiana is of a genre.,True
random,REFUTES,Random selection,NOT ENOUGH INFO,"NRG Recording Studios was created by a millionaire record producer, engineer and mixer.",False
random,REFUTES,Random selection,REFUTES,A River Runs Through It is a crisis.,True
random,NOT ENOUGH INFO,Random selection,SUPPORTS,Stanley Williams died.,False
random,SUPPORTS,Random selection,REFUTES,The Wallace is a novel.,False
random,NOT ENOUGH INFO,Random selection,NOT ENOUGH INFO,Youtube is ranked as the second most popular business in the world.,True
random,NOT ENOUGH INFO,Random selection,NOT ENOUGH INFO,Simón Bolívar was Dominican.,True
random,REFUTES,Random selection,REFUTES,Saturn Corporation is a registered voter.,True
random,REFUTES,Random selection,NOT ENOUGH INFO,Al Jardine is a brother.,False
random,NOT ENOUGH INFO,Random selection,NOT ENOUGH INFO,Guillermo del Toro is a carpenter.,True
random,REFUTES,Random selection,NOT ENOUGH INFO,The Mirny (sloop-of-war) was a ship of the moon.,False
